{
  "schemaVersion": 3,
  "name": "mewa_ui",
  "library": "mewa_ui",
  "canonicalAssets": {
    "foundations": [
      "library/src/base.css",
      "library/src/tokens.css"
    ],
    "fonts": [
      "library/src/google-sans-code.woff2"
    ],
    "licenses": {
      "googleSansCode": "library/src/licenses/GOOGLE-SANS-CODE-OFL.txt",
      "remixIcon": "library/src/licenses/REMIX-ICON-LICENSE.txt"
    },
    "icons": "library/src/icons/",
    "components": "library/components/",
    "runtime": "library/runtime/",
    "documentation": "docs/preview.html",
    "figmaDocumentation": "docs/figma.html",
    "system": "library/system/"
  },
  "designTokens": {
    "semantic": [
      {
        "name": "--background",
        "purpose": "Page canvas background.",
        "stability": "stable"
      },
      {
        "name": "--background-glass",
        "purpose": "Translucent page canvas for approved sticky shell chrome.",
        "stability": "stable"
      },
      {
        "name": "--surface-primary",
        "purpose": "Primary continuous content surface.",
        "stability": "stable"
      },
      {
        "name": "--surface-primary-glass",
        "purpose": "Translucent primary surface for approved sticky chrome.",
        "stability": "stable"
      },
      {
        "name": "--surface-secondary",
        "purpose": "Quiet structural surface for secondary grouping.",
        "stability": "stable"
      },
      {
        "name": "--surface-secondary-glass",
        "purpose": "Translucent secondary surface for approved sticky chrome.",
        "stability": "stable"
      },
      {
        "name": "--surface-alpha",
        "purpose": "General translucent surface independent of control semantics.",
        "stability": "stable"
      },
      {
        "name": "--surface-alpha-inverted",
        "purpose": "Inverted general translucent surface for contextual content.",
        "stability": "stable"
      },
      {
        "name": "--surface-control",
        "purpose": "Default translucent surface for an interactive control.",
        "stability": "stable"
      },
      {
        "name": "--surface-control-hover",
        "purpose": "Translucent surface for a hovered interactive control.",
        "stability": "stable"
      },
      {
        "name": "--surface-control-disabled",
        "purpose": "Translucent surface for a disabled interactive control.",
        "stability": "stable"
      },
      {
        "name": "--surface-control-invalid",
        "purpose": "Invalid surface for an interactive control.",
        "stability": "stable"
      },
      {
        "name": "--surface-control-inverted",
        "purpose": "Inverted surface for a selected or active control.",
        "stability": "stable"
      },
      {
        "name": "--surface-control-transparent",
        "purpose": "Transparent surface for an unfilled interactive control.",
        "stability": "stable"
      },
      {
        "name": "--surface-pointer",
        "purpose": "High-contrast surface for a draggable or range pointer.",
        "stability": "stable"
      },
      {
        "name": "--surface-pointer-disabled",
        "purpose": "Disabled surface for a draggable or range pointer.",
        "stability": "stable"
      },
      {
        "name": "--surface-pointer-inverted",
        "purpose": "Inverted surface for a pointer on an active track.",
        "stability": "stable"
      },
      {
        "name": "--surface-button-primary",
        "purpose": "Default filled surface for a primary button.",
        "stability": "stable"
      },
      {
        "name": "--surface-button-primary-hover",
        "purpose": "Hovered filled surface for a primary button.",
        "stability": "stable"
      },
      {
        "name": "--surface-button-secondary",
        "purpose": "Default transparent surface for a secondary button.",
        "stability": "stable"
      },
      {
        "name": "--surface-button-secondary-hover",
        "purpose": "Hovered surface for a secondary or quiet button.",
        "stability": "stable"
      },
      {
        "name": "--surface-button-disabled",
        "purpose": "Explicit disabled surface for a button action.",
        "stability": "stable"
      },
      {
        "name": "--surface-button-destructive",
        "purpose": "Default destructive surface for a button action.",
        "stability": "stable"
      },
      {
        "name": "--surface-button-destructive-hover",
        "purpose": "Hovered destructive surface for a button action.",
        "stability": "stable"
      },
      {
        "name": "--surface-menu-hover",
        "purpose": "Hover surface for menu items and highlighted menu choices.",
        "stability": "stable"
      },
      {
        "name": "--surface-content-hover",
        "purpose": "Hover surface for content rows and content triggers.",
        "stability": "stable"
      },
      {
        "name": "--surface-shell-hover",
        "purpose": "Hover surface for application shell links and actions.",
        "stability": "stable"
      },
      {
        "name": "--surface-hover",
        "purpose": "Theme-aware translucent surface for pointer and keyboard hover feedback.",
        "stability": "stable"
      },
      {
        "name": "--surface-selected",
        "purpose": "Theme-aware translucent surface for a selected or current item.",
        "stability": "stable"
      },
      {
        "name": "--surface-disabled",
        "purpose": "Theme-aware translucent surface for a disabled control or region.",
        "stability": "stable"
      },
      {
        "name": "--surface-positive",
        "purpose": "Supporting surface for positive status.",
        "stability": "stable"
      },
      {
        "name": "--surface-negative",
        "purpose": "Supporting surface for negative status.",
        "stability": "stable"
      },
      {
        "name": "--surface-destructive-hover",
        "purpose": "Hover surface for destructive menu and outline interactions.",
        "stability": "stable"
      },
      {
        "name": "--surface-caution",
        "purpose": "Supporting surface for caution status.",
        "stability": "stable"
      },
      {
        "name": "--surface-inverted",
        "purpose": "Highest-contrast normal surface for primary actions and signets.",
        "stability": "stable"
      },
      {
        "name": "--surface-destructive",
        "purpose": "Filled destructive action surface.",
        "stability": "stable"
      },
      {
        "name": "--overlay-subtle",
        "purpose": "Lowest-emphasis translucent overlay for local state and separation.",
        "stability": "stable"
      },
      {
        "name": "--overlay-moderate",
        "purpose": "Medium-emphasis translucent overlay for local state and separation.",
        "stability": "stable"
      },
      {
        "name": "--overlay-strong",
        "purpose": "Strong backdrop overlay behind modal top-layer content.",
        "stability": "stable"
      },
      {
        "name": "--text-primary",
        "purpose": "Primary readable text and icon color.",
        "stability": "stable"
      },
      {
        "name": "--text-secondary",
        "purpose": "Supporting readable text and icon color.",
        "stability": "stable"
      },
      {
        "name": "--text-disabled",
        "purpose": "Disabled text and icon color.",
        "stability": "stable"
      },
      {
        "name": "--text-inverted",
        "purpose": "Text and icon color on inverted surfaces.",
        "stability": "stable"
      },
      {
        "name": "--text-positive",
        "purpose": "Positive status text and icon color.",
        "stability": "stable"
      },
      {
        "name": "--text-negative",
        "purpose": "Negative status text and icon color.",
        "stability": "stable"
      },
      {
        "name": "--text-caution",
        "purpose": "Caution status text and icon color.",
        "stability": "stable"
      },
      {
        "name": "--border-primary",
        "purpose": "Default structural boundary.",
        "stability": "stable"
      },
      {
        "name": "--border-secondary",
        "purpose": "Stronger internal structural boundary.",
        "stability": "stable"
      },
      {
        "name": "--border-interactive-default",
        "purpose": "Default boundary for an interactive control.",
        "stability": "stable"
      },
      {
        "name": "--border-interactive-inverted",
        "purpose": "Inverted or selected boundary for an interactive control.",
        "stability": "stable"
      },
      {
        "name": "--border-transparent",
        "purpose": "Transparent boundary reserved for structural alignment and state.",
        "stability": "stable"
      },
      {
        "name": "--border-control",
        "purpose": "Required visible boundary of an unselected native choice control.",
        "stability": "stable"
      },
      {
        "name": "--border-muted",
        "purpose": "Low-emphasis or dashed boundary.",
        "stability": "stable"
      },
      {
        "name": "--border-subtle",
        "purpose": "Quiet boundary for low-separation regions.",
        "stability": "stable"
      },
      {
        "name": "--border-hover",
        "purpose": "Boundary color for an interactive element under hover.",
        "stability": "stable"
      },
      {
        "name": "--border-selected",
        "purpose": "Boundary color for a selected or current interactive element.",
        "stability": "stable"
      },
      {
        "name": "--border-disabled",
        "purpose": "Boundary color for a disabled control or region.",
        "stability": "stable"
      },
      {
        "name": "--border-focus",
        "purpose": "Theme-aware neutral boundary for authored focus indicators.",
        "stability": "stable"
      },
      {
        "name": "--border-invalid",